{"basis":{"identifier":"basis","kind":"orthonormal test basis","ordering":["s"],"orthonormal":true},"energy_reference":{"unit":"eV","zero":"explicit zero"},"geometry":{"boundary_conditions":"finite synthetic","cell":[[1.0,0.0,0.0],[0.0,1.0,0.0],[0.0,0.0,1.0]],"coordinate_convention":"cartesian row lattice vectors","length_unit":"angstrom","system":"synthetic"},"identifier":"minimal-operator","matrix":[[[0.0,0.0]]],"operator_kind":"finite_test_hamiltonian","provenance":{"source":"fixture"},"schema_version":1,"state_space":{"dimension":1,"identifier":"H_min","kind":"finite synthetic"}}
